,id,title,author,genre,story
150,150,햄버거가 제일 좋아,글 / 용현 / 그림 / 민국 / 화요웹툰 / ,#로맨스 #현실로맨스 #청춘로맨스 #연상연하 #삼각관계,"전남친과의 이별로 '사람알레르기'가 생긴 무화과, 과연 연애에 성공할 수 있을까? 초겨울 아직 텅 빈 신도시에서 만나게 된 자유로운 외톨이들의 눅눅한 사랑 이야기."
151,151,원포인트,글/그림 / 잇 / 화요웹툰 / ,#스포츠 #동아리 #스포츠성장,"“내가 빛나지 않아도 좋아, 경기에서 이긴 후 우리 팀을 주인공으로 만든다.”  고등학교 입학과 동시에 마주한 배구부의 모습에 실망한 ‘이재혁’, “이런 게, 배구부라고..?” 재혁은 어릴 적부터 함께 해온 ‘도민환’, 배구부의 악행에 질려버린 ‘김단우’와 함께 직접 팀을 꾸리기로 결심한다. 개성 넘치는 팀원들이 한 명씩 모이기 시작하고 서로 다른 친구들이 모여 하나의 목표를 향해 달려간다. 목표는 최정상!!"
152,152,로맨스 당도 백퍼센트,"글/그림 / 이동건 / 화, 토 연재 / ",#일상 #러블리 #짝사랑 #2030연애 #로맨스코미디 #현실로맨스 #하이퍼리얼리즘,"로맨스 전문 웹툰작가 러빙건의 신작을 위해 다시 모인 팀원들! 러빙건은 소재 발굴을 위해 과거의 기억들로 항해를 떠나고, 오직 만화만을 사랑하는 어시스트 루나도 함께한다. 새로운 웹툰을 준비하면서 각자의 로맨스를 깨우는 우당탕탕 만화제작기."
153,153,은밀한 재택근무,글 / 굴닭 / 그림 / 타단 / 원작 / 주황연 / 화요웹툰 / ,#로맨스 #재벌 #2030연애 #로맨스코미디 #현실로맨스 #친구>연인 #직진남,"평범한 회사원인 '한다연'.  회사의 사활이 걸린 프로젝트를 성사시키기 위해, 벤처 기업의 대표이자 동창 '이지안'의 요구대로 그의 비서가 된다. 고등학교 시절 첫 키스를 망친 그 녀석과 재택 근무라니! 하지만 다연은 자신이 지안의 첫사랑이었다는 사실을 알게 되고, 지안이 마음을 숨기지 않으면서, 두 사람은 점점 가까워지는데..."
154,154,대리게임,글/그림 / 철준 / 화요웹툰 / ,#스릴러 #게임판타지 #학원물 #복수극,"같은 학교의 유찬에게 매주 상납금을 바치며 괴로운 나날을 보내는 도윤. 어느 날, 온라인 게임에서 만난 게임 개발자인 지인에게 어떤 인디게임을 받게 되고 도윤은 게임의 주인공이 자신과 똑같은 처지에 처해있다는 사실에 놀란다. 혹시나 하는 마음 반, 호기심 반에 괴롭히는 자신을 유찬에게 잔인한 복수를 게임에서 선택하고 다음 날을 맞는다. 도윤의 일상은 게임과 똑같이 흘러가기 시작하고... 수상했던 게임은 도윤의 인생을 게임의 선택지로 송두리째 바꿔놓는다."
155,155,공작저의 붉은 밤,글 / H.C / 그림 / 타샤토토 / 원작 / 유세라 / 화요웹툰 / ,#로맨스 #선결혼후연애 #뱀파이어 #로판 #구원서사 #소설원작,"""피곤하겠지만, 혼인신고부터 합시다.""  다짜고짜 찾아와 결혼을 하자는 뱀파이어!  이게 바로, 아빠의 숨겨진 계획!?  갑작스럽게 남편이 생긴 것도 모자라,  어마어마한 유산의 주인공이 된 시골 소녀, 소렐.  얼떨결에 대학 생활과 신혼을 함께 보내게 생겼다.  숨겨진 대마법사의 딸과 젠틀 뱀파이어의 붉은빛 신혼 일기!"
156,156,돌격! 용마치킨,글/그림 / 팀 오누이 / 화요웹툰 / ,#판타지,치킨집 수렴의 법칙. 당신이 문과든 이과든 결국은 치킨집을 하게 된다!  ....라는 법칙은 세상을 구하고 돌아온 용사도 예외는 아니었다. 그러나 신의 계략으로 용사는 마왕과 함께 빚을 갚아야 하는데…   빚? 갚아주겠어… 바로 이 치킨으로! 그런데… 직원들의 상태가 심상치 않다? 용사와 마왕의 눈물나는 자본주의 극복기
157,157,왕자님 짠내밥상,글/그림 / 쑥 / 화요웹툰 / ,#드라마,오승지는 자신을 버린 엄마를 찾기 위해 베르사유 궁전 201호를 찾게 된다. 그곳은 궁전이 아닌 허름하고 낡은 고시원이었고 엄마가 아닌 '브루봉 그룹 4대 후계자'로 소문난 루이가 살고 있었다. 그리고 그들의 하루하루 먹고살기 위한 짠내 나는 생존 요리가 펼쳐진다.
158,158,동경과 거짓말,글/그림 / 오한 / 화요웹툰 / ,#드라마 #음악 #2021 지상최대공모전 #성장드라마 #구원서사,"음악을 순수히 동경하는 편입생, 에델바이스 밀런. 그러나 음악 학원에 계속해서 다니고 싶다면 자기 대신 후계자인 척하라는 후계자의 협박을 받고 가짜 신분을 유지하기 위해 고군분투한다."
159,159,원수가 나를 유혹할 때,글 / 황비노 / 그림 / 포롱 / 원작 / 최서희 / 화요웹툰 / ,#로맨스 #폭스남 #2030연애 #로맨스코미디 #회귀 #직진남 #소설원작,"언니가 약혼자에게 버림 받고 죽었다. 시간을 되돌릴 수만 있다면… 다신 그런 남자에게 언니 안 보내! 언니가 행복해질 수 있도록 매니저가 되어 고군분투하는 해민. 그런데, 원수 같던 그 남자가 나를 유혹할 때 난 어쩌면 좋지?"
160,160,DARK MOON: 회색 도시,글/그림 / HYBE / 화요웹툰 / ,#판타지 #세계관 #다크판타지 #느와르,"뱀파이어들의 위협에서 도망쳐 바닷가 마을에 정착하고자 하는 늑대소년들. 그리고 이곳 마을에서 '악마'라 낙인 찍혀 괴롭힘을 당하고 있던 또 한 명의 소년 칸. 이들은 서로 만나 조금씩 가까워진다. 평화로운 학교생활을 기대했건만, 어느 날 조용했던 마을에 살인사건이 벌어지게 되고, 칸의 태생적 비밀이 드러나면서 소년들은 또 다른 위험을 마주하게 되는데..."
161,161,"헥토파스칼
휴재",글 / 버퍼링 / 그림 / 길성근 / 화요웹툰 / ,#액션 #복수극 #느와르,"전설로 불리던 싸움꾼 박한준. 더 이상 잃을 것도 없어 좌절하던 그에게 막대한 돈이 주어진다. 눈 에는 눈, 이 에는 이! 내가 당한 것만큼 반드시 되갚아 주겠다! 받은 것보다 더 돌려주는 통쾌한 복수, 그의 거침없는 분노가 폭발한다!"
162,162,"너의 순정, 나의 순정",글/그림 / 정살 / 화요웹툰 / ,#로맨스 #학원로맨스,"반장인 태리는 최근 계속해서 반 분위기를 흐리는 권지호 무리 때문에 스트레스를 받는다. 그러던 중 우연히 알게 된 지호의 비밀을 약점 잡아 지호를 제압하는데 성공하고, 그 일을 기점으로 지호는 태리에게 꼼짝하지 못하며 그렇게 둘의 비밀스러운(?) 상하관계가 시작되는데…"
163,163,AI 유하,글 / 박현 / 그림 / 지홍주 / 화요웹툰 / ,#로맨스 #아이돌연애 #로맨스코미디 #현실로맨스 #연예계 #삼각관계,"데뷔 10년 차 인기 아이돌 유하.  그리고 그녀의 1호 팬 도현.    그런 도현의 눈앞에 어느 날 유하가 나타나 도움을 청하지만,  도현은 자신이 유하라고 말하는 그녀를 도저히 믿을 수가 없다.  왜냐면... '유하는 이 세상에 존재할 수 없는 AI니까!'    버추얼 아이돌과 찐팬의 비밀 가득 로맨스  이 둘의 소망은 과연 이뤄질 수 있을까?!"
164,164,화산귀환,글/그림 / LICO / 원작 / 비가 / 수요웹툰 / ,#무협/사극 #세계관 #동양풍판타지 #회귀 #힘숨찐 #이세계 #먼치킨 #소설원작,대 화산파 13대 제자.천하삼대검수 매화검존 청명.  천하를 혼란에 빠뜨린 고금제일마 천마의 목을 치고 십만대산의 정상에서 영면. 백 년의 시간을 뛰어넘어 아이의 몸으로 다시 살아나다. ......뭐? 화산이 망해? 이게 뭔 개소리야!?
165,165,무직백수 계백순,"글/그림 / 지발 / 수, 일 연재 / ",#개그 #요즘핫한추천작,"해둔 것도 없고, 스펙도 평범, 통장 잔고는 늘 만원 이하. 등골 브레이커 계백순은 과연 백수에서 탈출할 수 있을까?"
166,166,전지적 독자 시점,글 / UMI / 그림 / 슬리피-C / 원작 / 싱숑 / 수요웹툰 / ,#판타지 #세계관 #레드아이스 스튜디오 #아포칼립스 #게임판타지 #헌터물,"'이건 내가 아는 그 전개다' 한순간에 세계가 멸망하고, 새로운 세상이 펼쳐졌다. 오직 나만이 완주했던 소설 세계에서 평범했던 독자의 새로운 삶이 시작된다."
167,167,백XX,글 / 병장 / ,#액션 #지금추천작 #범죄,"정보사(HID) 요원 '백이수'와 범죄 조직의 보스인 쌍둥이 형 '백도경'. 같은 얼굴 다른 삶을 살아온 쌍둥이 형제. 조직에 배신당한 동생은 자신의 신분을 버리고 형이 되기로 한다. 정보사요원, 범죄 조직의 보스가 되다...!"
168,168,캐슬2:만인지상,글/그림 / 정연 / 수요웹툰 / ,#액션 #요즘핫한추천작 #지금추천작 #범죄 #사이다 #복수극 #먼치킨 #느와르,뒷세계 절대권력 '캐슬'을 무너뜨리기 위하여 전국의 남자들을 모아 '백의'를 조직한 특급킬러 '김신'은  그렇게 캐슬 내부로 들어가 적과의 동침을 시작하는데.. 과연 김신은 자신이 염원하던대로 캐슬을 무너뜨리고 복수를 완성할수 있을까.
169,169,66666년 만에 환생한 흑마법사,글 / 팀 더 지크 / 그림 / 파사 / 원작 / 화봉 / 수요웹툰 / ,#판타지 #회귀 #먼치킨 #소설원작,"강대했던 흑마법사 디아블로 볼피르. 12신의 계략에 당해 억겁 속에 봉인되었지만, 그로부터 66666년이 흘러 다시금 이 땅에 강림한다! ""응애!"" 웰턴 백작의 갓 태어난 장남으로. 딥다크 매직 판타지 시작!"
170,170,성역의 기묘한 이야기,글/그림 / 조석 / 수요웹툰 / ,#판타지,"""본 컨텐츠는 조석 작가가 들려주는 디아블로IV 브랜드웹툰<성역의 기묘한 이야기>입니다."" 주연보다 조연이었던 디아블로 IV의 ‘하급 악마’와 ‘성역의 인간’들의 잔혹한 이야기"
171,171,일렉시드,글 / 손제호 / 그림 / 제나 / 수요웹툰 / ,#액션 #세계관 #학원물 #이능력배틀물 #성장드라마 #동물,<노블레스> 손제호 작가와 <소녀더와일즈> 제나 작가가 만났다! 고양이 몸에 깃든 각성자 카이든과 각성능력을 숨겨온 고등학생 지우  러블리 2인조의 액션 판타지
172,172,미래의 골동품 가게,글/그림 / 구아진 / 수요웹툰 / ,#스릴러 #오컬트,"남해의 먼 섬에 살고 있는 소녀, '미래'. 미래의 부모님이 바다에서 돌아오지 못한 그날부터, 모든 것들이 변하기 시작했다.  저주를 풀기 위한 단 한 가지의 방법.  소중한 것들을 지키기 위한 기묘한 소녀의 퇴마가 시작된다."
173,173,칼에 취한 밤을 걷다,글 / JP / 그림 / 송민 / 원작 / 유진성 / 수요웹툰 / ,#무협/사극 #세계관 #사이다 #판무 #소설원작,"진소한은 본디 고아 출신이었으나,  현월검무단이 거두어 그녀들과 어린 시절을 함께 보낸다.  하지만 어느 날 그의 특수한 신체 특성을 알아본 사대악인 중 하나인 독마에게 납치당하고,  온갖 실험 끝에 결국 제자로까지 키워지게 된다.  10년 뒤, 그는 현월검무단의 흔적을 찾아보려 하지만,  검무단은 이미 고향을 지배하는 흑도들의 손에 사라져 버렸는데!"
174,174,튜토리얼 탑의 고인물,글/그림 / 토프 / 원작 / 방구석김씨 / 수요웹툰 / ,#액션 #고인물 #아포칼립스 #사이다 #게임판타지 #헌터물 #먼치킨 #소설원작,"전 세계에 몬스터와 함께 등장한 의문의 탑들. 이 탑들은 사람들을 선별하고, 선별자들은 100층까지 클리어를 해야 다시 세상으로 나갈 수 있다.  이에 주인공 김현우는 다른 선별된 사람들과 함께 100층까지 공략하지만 알 수 없는 이유로 나가지 못하고 다시 1층으로 돌아와버린다. 그 후 김현우는 탑을 나가기 위해 수없이 100층을 반복하여 깨고…  그런 생활을 12년 동안이나 반복하던 어느 날, 갑자기 루프가 풀려 세상 밖으로 나갈 수 있게 된다."
175,175,왕따가 격투기를 너무 잘함,글/그림 / 팀꿀빨 / 원작 / 아몬드빵 / 수요웹툰 / ,#액션 #지금추천작 #소설원작,종합격투기 선수 차무결은 장회장의 꼬임에 넘어가 무체급 격투기를 하던중 식물인간이 된다. 이후 장회장의 이미지 쇄신용으로 이용당하는 차무결. 결국 죽게되는 그는 동명의 고등학생 차무결의 몸에 빙의된다. 내구도 s급의 단단한 몸. 격투기 능력을 업그레이드 시켜 줄 수 있는 상태창 능력. 이번엔 다르다. 이루지 못한 최강자의 꿈과 함께 장회장에게 복수하기 위한 싸움이 시작된다.
176,176,나쁜사람,글/그림 / 둠스 / 수요웹툰 / ,#액션 #학원물,착한 남자가 좋다는 그녀의 이상형이 되기 위해 10년 동안 노력했다.  그런데! 갑자기 나쁜 남자가 좋다는 그녀...  오늘부터 난... 나쁜 남자로 다시 태어난다.
177,177,황후를 훔친 이는 누구인가,글 / 핀쿠 / 그림 / 뮬리 / 원작 / Lee jihye / 수요웹툰 / ,#로맨스 #로판 #소설원작,"흩날리는 매서운 눈발. 그 속에 덩그러니 남겨진 로젤린은 기꺼이 죽음을 받아들이기로 했다.    살아 있을 이유가 없었다. 가족도, 친구도, 욕망도 남아 있지 않았으니….  고통스러운 추위 속에서 이렇게 얼어 죽는 것도 나쁘지 않겠구나 싶던 그 때, 적국의 대장군, 타몬 크라시스가 버려진 그녀를 훔쳐 달아났다."
178,178,망치하르방,"글/그림 / 상상어 / 수, 토 연재 / ",#판타지 #힘숨찐 #먼치킨,“왜 우리 집 형편에 내 꿈을 맞춰야 해?” 마법사가 되고 싶은 '탄'.  50년 동안의 망치질로 마법 학교 학비를 마련하는데 성공한다.  70살 할아버지의 마법학교 입학기!  그런데 나... 마법사보다 강한 몸이 되어버렸을지도...?
179,179,마른 가지에 바람처럼,글/그림 / 화음 / 원작 / 달새울 / 수요웹툰 / ,#로맨스 #이세계 #구원서사 #소설원작,"남편을 잃고, 아이를 빼앗기고, 이제 생매장을 눈 앞에 둔 과부 리에타.  그 곳에 ‘미친 폐황자’로 불리는 저주받은 땅, 악시아스 성의 대공. 킬리언이 나타났다. 그녀를 데려가겠다고 말하는 킬리언이 인사를 건넨다. “안녕, 요부”"
180,180,내가 죽기로 결심한 것은,글/그림 / YUJU / 수요웹툰 / ,#로맨스 #폭스남 #집착물 #청춘로맨스 #재회,"태권도 국가대표 선발전을 앞두고 부상을 입은 고3 지오는 뒤늦은 사춘기를 맛보는 중이다.  온갖 찌질한 생각이 드는 와중에 만나게 된 차결은 살랑살랑 웃어대며 지오를 완전히 홀려 버리는데, 맘 놓고 홀리기엔 차결의 주변 사람들이 어쩐지 위험하다.  머리로는 경계해야 하는 걸 알지만, 결을 향한 관심은 멈출 수가 없다. 얘… 좋아해도 되는 걸까?"
181,181,쓰레기는 쓰레기통에!,글/그림 / EDDiERiNG / 수요웹툰 / ,#로맨스 #계략여주 #2021 지상최대공모전 #현실로맨스 #서스펜스,"잘생긴 외모로 돈 많은 여자들을 유혹하며 쓰레기처럼 살아가던 '우빈'.  단지 유혹의 대상이었던 재벌 상속녀 '수지'를 역으로 사랑해버리게 된다.  처음으로 찾아온 사랑의 달콤함도 잠시,  천사 같은 그녀의 겉모습 뒤에 감춰진 악취는 우빈을 점점 옥죄여오기 시작하는데...  분리수거도 안 되는 인쓰들의 로맨스!"
182,182,사상최강,글/그림 / 이단아 / 원작 / 황규영 / 수요웹툰 / ,#무협/사극 #사이다 #먼치킨 #소설원작,‘천하 십대 고수’라고 불리는 자들. 인간의 한계를 뛰어넘은 그들은 서로를 견제하며 힘의 균형과 세상의 질서를 유지해왔다. 바로 ‘백도현’ 그가 나타나기 전까지는! 내공만으로 사상최강의 힘을 가진 남자 백도현의 시원한 한 방!
183,183,베이비 폭군,글/그림 / 아원 / 원작 / 이흰 / 수요웹툰 / ,#로맨스 #육아물 #소설원작,"가질 수 없었던 화목한 가정, 다정한 부모님. 비참한 결말 끝에 눈을 떠 보니, 환생했다. 그것도 제국의 공주로!  그런데 이 나라 좀 이상하다! 오빠 같은 아빠, 꼬리 하나 달렸을 거 같은 진짜 오빠가 시도 때도 없이 찾아와서 귀찮게 한다!  하지만 가족의 사랑 따위 필요 없어! 이번 생엔 조용히 지내다가 떠날 거야! 그랬는데! 분명 내 목표는 그랬는데! 황궁의 숲을 주질 않나, 성을 하사하질 않나, 이젠 심지어 한 살인 나에게 나라를 주겠다고?!  이 나라는 미쳤다!!  “안 돼! 이대로 나의 조용한 생활을 포기할 순 없어!”"
184,184,"빌드업
휴재",글/그림 / 911 / 수요웹툰 / ,#스포츠 #2019 지상최대공모전 #축구 #스포츠성장 #소년왕도물,축구덕후지만 볼보이만 5년째?!  빵셔틀 강마루의 열혈청춘 축구드라마
185,185,에브리띵 이즈 파인,글/그림 / 마이크 버첼 / 수요웹툰 / ,#스릴러 #해외작품,"샘과 매기는 평범한 동네에서 평범한 가정을 꾸리는 평범한 부부다. 그들이 쓰고 있는 마스크도, 그들 곁에 있는 이웃들도, 그들이 기르는 반려견도 모두 그들의 평범한 일상일 뿐이다. 그들의 평범한 일상은 전혀 문제가 없어 보인다.  2022 미국 하비상 '올해의 디지털 도서' 노미네이트 작품"
186,186,마님이네 미국 시골집 이야기,"글/그림 / 마님 / 수, 토 연재 / ",#일상 #러블리 #힐링 #동물,"마님♡올리버쌤♡체리 가족이 찾아왔습니다! 미국 남자 올리버와 토종 한국인 마님, 그리고 사랑스러운 딸 체리와 다섯 마리 반려 동물까지. 하루종일 육아하고 털 청소하느라 바쁘지만, 그래도 하하 호호 행복한 미국 시골집 이야기."
187,187,중간에서 만나,글 / 조흰 / 그림 / 윤김 / 수요웹툰 / ,#로맨스 #폭스남 #로맨스코미디 #연상연하,"""내가 재밌게 해줄 수 있는데."" 서른 살, 노잼 인생을 살고 있는 여름 앞에 어느 날 나타난 미스테리 연하남! 앞뒤 가리지 않고 직진하는 모습이 그저 귀엽다가도,  어딘가 세하고 어딘가 집착적인데?   대체 너 나한테 원하는 게 뭐니?! 두근두근 쌍방사기 로맨스 코미디!"
188,188,흔한 빙의물인 줄 알았다,글 / DOYOSAY / 그림 / 아진 / 원작 / 레몬개구리 / 수요웹툰 / ,#로맨스 #로판 #소설원작,"그럼 그렇지, 내 팔자에 무슨 주인공이야.   남편 손에 죽을 팔자의 악녀였지만, 난 이 클리셰를 안다! 억울하게 죽은 대가로는 꽤 괜찮다고 생각했다. 원작의 흐름에서 벗어나지 못한다는 걸 깨닫기 전까지는. 결국 원작대로 죽을 거라면, 초미남 남편에게 뽀뽀라도 해보자!   ""리겔호프의 꽃뱀답게 나를 만족시켜 보십시오. 또 모르잖습니까. 몸정이라도 생길지.""  ......왜 원작이 달라지기 시작하는 거지?"
189,189,"안녕, 나의 수집","글/그림 / 하린 / 수, 일 연재 / ",#일상 #무해한,슈퍼 '맥시멀리스트'였던 내가 어느 날 '미니멀리즘'에 눈을 떴다?!  이것저것 사 모으는 걸 좋아했던 맥시멀리스트 '무주'. 어느 날 포화상태가 된 방을 보고 '이대론 안되겠다'라는 생각이 들었다.  저마다 다양한 사연을 갖고 있는 물건들을 비워내며 미니멀리스트가 되려 하는 무주와 물건의 이야기!
190,190,악의 등교,글 / 팀 더 지크 / 그림 / 시원 / 원작 / 산천 / 수요웹툰 / ,#액션 #학원물 #소설원작,"성적 우수, 용모 단정, 싸움 실력 평균 이상 그리고 약간의 정의로움. 1등급 모범생 김현성은 졸업을 앞둔 어느 날 옥상에서 떠밀려 식물인간이 되고 만다. 청각과 의식만 살아 있는 상태로 죽지도 못하고 지옥 같은 나날을 보낸 지 10년, 그는 불현듯 괴롭힘이 시작된 그날로 돌아온다."
191,191,닥터앤닥터 병원일기,글/그림 / 닥터베르 / 수요웹툰 / ,#일상 #육아물 #의학드라마,"공학박사 닥터(Ph.D)베르와 산부인과 전문의 닥터(Dr.)안다는 닥터앤닥터 부부다.  아들 레서를 키우다 경력이 단절된 닥터베르는 돌연 웹툰 작가에 도전한다.  하지만 데뷔의 기쁨도 잠시. 알고 보니 혈액암 4기라고?  믿기 힘든 일상을 통해 새롭게 맺어진 인연들의 이야기, 지금 시작합니다."
192,192,헤어지면 죽음,글 / 봄소희 / 그림 / KYMA / 수요웹툰 / ,#로맨스 #레드스트링 #인플루언서,"완벽한 인플루언서의 삶. 좋아하는 여자와의 썸. 고백만이 남았는데 황당한 테러 사건에 휘말렸다?! ""집착이 아니라 진짜로 우리..! 헤어지면 죽어!!"""
193,193,칼부림,글/그림 / 고일권 / 수요웹툰 / ,#무협/사극 #역사물 #판무,뜻을 품고 한을 품은 팔도의 자제들아 서슬퍼런 칼날 내보이라! 이괄의 난을 배경으로 펼쳐지는 함이의 복수와 성장
194,194,급식아빠,글/그림 / 김재한 / 수요웹툰 / ,#액션 #학원물,<부활남> 김재한 작가의 신작! 딸바보 웹툰작가의 갑작스러운 죽음. 학원액션 만화를 그리던 능력(?)을 살려 일진 서클 12간지로부터 딸 다연이를 지켜라! 딸이 괴롭힘당하는 모습을 보게 된다면? ...이건 못 참지. 내 딸 건드는 새끼들 다 조져버림.
195,195,좀간,글 / 옹구 / 그림 / 다이 / 수요웹툰 / ,#액션,"모두가 살기 위해 발버둥 치는 세상 속, 유일하게 죽음을 원하는 소년, 온미래. 어느날 그의 앞에 필살부대가 나타나 제안을 건넨다. '너를 죽여줄테니, 인간 사회를 함께 재건해다오' 죽기 위해선, 모두를 살려야 한다."
196,196,어린 상사,글/그림 / LICO / 원작 / 박수정 / 수요웹툰 / ,#로맨스 #현실로맨스 #오피스로맨스 #소설원작,"지루한 연애 끝에 결혼을 앞둔 평범한 직장인, 강시현.  그녀 앞에 어릴 적 자신이 돌봤던 아이, 윤태하가 나타났다. 새로 부임한 본부장, 그러니까 시현의 상사로.   “너 나한테 이러면 안 돼. 세상에 마지막 남은 남자가 너라도 우린 안 된다고!”  그토록 귀여웠던 어린아이가, 어느덧 남자의 눈빛으로 그녀를 바라보며 말한다.   ""그 결혼, 나랑 해."""
197,197,인과관계,글/그림 / 강환영 / 수요웹툰 / ,#로맨스 #힐링 #학원로맨스 #청춘로맨스 #삼각관계,스킨십 공포증이 있는 유라의 곁엔 오로지 소꿉친구인 해원이뿐이었지만 고인우와 권미인 그리고 다양한 사람들과 만나게 되면서 새로운 감정을 알아가고 진정한 인간관계를 쌓아간다.
198,198,판타지 여동생!,글/그림 / 유누 / 수요웹툰 / ,#판타지 #게임판타지,게임 초보 여동생의 RPG 도전기. 트롤 취급은 노노! 제가 사실 엄청난 히든 직업을 갖고 있거든요?
199,199,결혼 시뮬레이션,글 / 김래잇 / 그림 / 황주영 / 수요웹툰 / ,#드라마,"가까운 미래. 점점 떨어지는 혼인율, 감소하는 인구. 결혼은 더 이상 사랑이 아닌 투자이다. ""그 투자, 저희가 도와드립니다.""  상대방과 결혼한 미래를 시뮬레이션으로 보여주는 ""결혼 시뮬레이션"" 결혼을 고민하던 커플들은 상대의 민낯을 샅샅이 보게된다."
200,200,언덕 위의 제임스,글/그림 / 쿠당탕 / 수요웹툰 / ,#개그 #4차원,제임스들이 펼치는 코믹 막장 에피소드! 지금 전세계의 제임스들이 몰려온다
201,201,하렘의 남자들,글 / 히어리 / 그림 / 영빈 / 원작 / 알파타르트 / 수요웹툰 / ,#로맨스 #궁중로맨스 #이세계 #역하렘 #로판 #소설원작,"""내 후궁들부터 들이기로 하였다. 한 다섯 정도."" 타리움 제국의 황녀, 라틸. 그녀의 첫사랑 하이신스는 황제가 되기 위해 본국 권력자의 딸과 결혼한다. 충격 받는 라틸. 하지만 그 충격이 가시기도 전에 황태녀가 되고,이복남매의 반란 세력에 맞서 황위를 지켜낸다. 그렇게 여황제가 된 라틸에게 대신들은 국서를 맞을 것을 제안하는데, 뭔가, 심기에 거슬린다. '왜 여황제는 후궁을 못 들인다는 거지?' ""저도 최소 다섯 명은 후궁으로 두어야겠습니다. 제가 좋다면 하렘으로 들여보내세요, 보고 마음에 드는 사람을 국서로 삼을 것입니다.""  전무후무한 여황제의 하렘으로, 치명적인 매력의 남자들이 모여든다!"
202,202,괴물공작의 딸,글 / 한바다 / 그림 / 찬란 / 수요웹툰 / ,#판타지 #힐링 #육아물,"세상과 단절되어 살아가던 나는 '괴물공작' 이라 불리는 아빠에게 거둬졌다. 어느 날, 아빠의 서재에서 이상한 책을 발견하는데… 이거 내용이 왜 이래? 내가 병 때문에 죽는다고? 그러면서 양녀를 들이고 잘해줘? 어차피 죽을 거라면 그전에는 뭘 해도 안 죽는다는 거잖아! 그렇다면, 정말 로티 맘대로 해버릴 거야!"
